{
  "schemaVersion": 1,
  "baselineVersion": 1,
  "workPackage": "WP-001",
  "generatedAt": "2026-10-06T14:40:39.626Z",
  "releaseVersion": "2.7.67",
  "scope": {
    "root": ".",
    "exclusions": [
      ".env*",
      ".git/**",
      ".tmp/**",
      "coverage/**",
      "data/**",
      "node_modules/**",
      "out/**",
      "**/*.log"
    ],
    "contentScanAdditionalExclusions": [
      "config/bots/**"
    ],
    "selfOutputsExcludedFromCounts": [
      "architecture/baseline/current.json"
    ],
    "reproducibleCommands": [
      "rg --files --hidden -g '!.env*' -g '!.git/**' -g '!.tmp/**' -g '!coverage/**' -g '!data/**' -g '!node_modules/**' -g '!out/**' -g '!*.log' -g '!architecture/baseline/current.json'",
      "node scripts/inspect-architecture-baseline.js",
      "node scripts/inspect-architecture-baseline.js --check",
      "node scripts/validate-architecture.js --json",
      "node --test tests/unit/architecture/ArchitectureBaseline.test.js"
    ]
  },
  "revision": {
    "available": false,
    "revision": null,
    "branch": null,
    "worktree": {
      "state": "STANDALONE",
      "inScopeChangedPaths": 0
    },
    "reason": "Standalone source tree; version-control metadata is intentionally not required.",
    "sourceFingerprintSha256": "aa2ff53e26847df18bad096e6d25393d3e65330c3bd4a74317815f016bc720dd"
  },
  "counts": {
    "files": 1040,
    "source": 428,
    "tests": 272,
    "scripts": 41,
    "configJson": 35,
    "routes": 1
  },
  "sourceAreas": [
    {
      "area": "<root>",
      "files": 1,
      "owner": "src/index.js",
      "layer": "runtime-entrypoint",
      "classification": "CURRENT"
    },
    {
      "area": "bootstrap",
      "files": 17,
      "owner": "src/bootstrap/",
      "layer": "composition-root",
      "classification": "CURRENT"
    },
    {
      "area": "bot",
      "files": 10,
      "owner": "src/bot/",
      "layer": "bot-runtime",
      "classification": "CURRENT"
    },
    {
      "area": "commands",
      "files": 10,
      "owner": "src/commands/",
      "layer": "command-capability",
      "classification": "CURRENT"
    },
    {
      "area": "configuration",
      "files": 16,
      "owner": "src/configuration/",
      "layer": "application-configuration",
      "classification": "CURRENT"
    },
    {
      "area": "connection",
      "files": 7,
      "owner": "src/connection/",
      "layer": "bot-connection",
      "classification": "CURRENT"
    },
    {
      "area": "core",
      "files": 14,
      "owner": "src/core/",
      "layer": "platform-core",
      "classification": "CURRENT"
    },
    {
      "area": "desktop",
      "files": 72,
      "owner": "src/desktop/",
      "layer": "control-plane-desktop",
      "classification": "CURRENT"
    },
    {
      "area": "diagnostics",
      "files": 17,
      "owner": "src/diagnostics/",
      "layer": "observability",
      "classification": "CURRENT"
    },
    {
      "area": "discord",
      "files": 15,
      "owner": "src/discord/",
      "layer": "control-plane-discord",
      "classification": "CURRENT"
    },
    {
      "area": "fleet",
      "files": 1,
      "owner": "src/fleet/",
      "layer": "fleet-scheduling",
      "classification": "CURRENT"
    },
    {
      "area": "gui",
      "files": 25,
      "owner": "src/gui/",
      "layer": "gui-capability",
      "classification": "CURRENT"
    },
    {
      "area": "items",
      "files": 22,
      "owner": "src/items/",
      "layer": "item-inventory-capability",
      "classification": "CURRENT"
    },
    {
      "area": "modes",
      "files": 48,
      "owner": "src/modes/",
      "layer": "mode-platform",
      "classification": "CURRENT"
    },
    {
      "area": "movement",
      "files": 13,
      "owner": "src/movement/",
      "layer": "movement-capability",
      "classification": "CURRENT"
    },
    {
      "area": "operations",
      "files": 7,
      "owner": "src/operations/",
      "layer": "operation-platform",
      "classification": "CURRENT"
    },
    {
      "area": "planning",
      "files": 10,
      "owner": "src/planning/",
      "layer": "pure-planning",
      "classification": "CURRENT"
    },
    {
      "area": "recovery",
      "files": 5,
      "owner": "src/recovery/",
      "layer": "durable-control",
      "classification": "CURRENT"
    },
    {
      "area": "server-features",
      "files": 84,
      "owner": "src/server-features/",
      "layer": "server-domain-features",
      "classification": "CURRENT"
    },
    {
      "area": "server-profiles",
      "files": 4,
      "owner": "src/server-profiles/",
      "layer": "server-profile-boundary",
      "classification": "CURRENT"
    },
    {
      "area": "shared",
      "files": 26,
      "owner": "src/shared/",
      "layer": "shared-foundation",
      "classification": "CURRENT"
    },
    {
      "area": "simulation",
      "files": 4,
      "owner": "src/simulation/",
      "layer": "simulation-replay",
      "classification": "CURRENT"
    }
  ],
  "reachability": {
    "runtimeEntrypoints": [
      {
        "file": "src/index.js",
        "exists": true,
        "directLocalDependencies": [
          "src/bootstrap/RuntimeEnvironment.js",
          "src/bootstrap/createApplication.js",
          "src/bootstrap/shutdown.js"
        ],
        "reachableSourceFiles": 345
      },
      {
        "file": "src/desktop/main.js",
        "exists": true,
        "directLocalDependencies": [
          "src/desktop/DesktopController.js",
          "src/desktop/DesktopFatalRecovery.js",
          "src/desktop/DesktopPreferenceStore.js",
          "src/desktop/DesktopShutdownSequence.js",
          "src/desktop/contracts/DesktopApiContract.js",
          "src/desktop/incidents/IncidentIndexStore.js",
          "src/desktop/presentation/CommandPaletteCatalog.js",
          "src/desktop/projection/SnapshotDeliveryCoordinator.js",
          "src/desktop/readiness/DesktopReadinessService.js",
          "src/desktop/update/LocalZipUpdateService.js",
          "src/desktop/update/SquirrelLifecycle.js",
          "src/desktop/update/local-update-helper.js",
          "src/desktop/use-cases/DesktopRuntimeBootstrap.js"
        ],
        "reachableSourceFiles": 395
      },
      {
        "file": "src/desktop/preload.js",
        "exists": true,
        "directLocalDependencies": [],
        "reachableSourceFiles": 1
      },
      {
        "file": "src/desktop/renderer/core/RendererApiClient.js",
        "exists": true,
        "directLocalDependencies": [],
        "reachableSourceFiles": 1
      },
      {
        "file": "src/desktop/renderer/core/Html.js",
        "exists": true,
        "directLocalDependencies": [],
        "reachableSourceFiles": 1
      },
      {
        "file": "src/desktop/renderer/core/RendererRouter.js",
        "exists": true,
        "directLocalDependencies": [],
        "reachableSourceFiles": 1
      },
      {
        "file": "src/desktop/renderer/core/DevRouter.js",
        "exists": true,
        "directLocalDependencies": [],
        "reachableSourceFiles": 1
      },
      {
        "file": "src/desktop/renderer/core/KeyedDom.js",
        "exists": true,
        "directLocalDependencies": [],
        "reachableSourceFiles": 1
      },
      {
        "file": "src/desktop/renderer/core/RendererSnapshotLoop.js",
        "exists": true,
        "directLocalDependencies": [],
        "reachableSourceFiles": 1
      },
      {
        "file": "src/desktop/renderer/core/RendererStore.js",
        "exists": true,
        "directLocalDependencies": [],
        "reachableSourceFiles": 1
      },
      {
        "file": "src/desktop/renderer/components/AccessibleDialog.js",
        "exists": true,
        "directLocalDependencies": [],
        "reachableSourceFiles": 1
      },
      {
        "file": "src/desktop/renderer/pages/PageCatalog.js",
        "exists": true,
        "directLocalDependencies": [],
        "reachableSourceFiles": 1
      },
      {
        "file": "src/desktop/renderer/pages/ConfigGroupCatalog.js",
        "exists": true,
        "directLocalDependencies": [],
        "reachableSourceFiles": 1
      },
      {
        "file": "src/desktop/renderer/features/b5/B5ViewModel.js",
        "exists": true,
        "directLocalDependencies": [],
        "reachableSourceFiles": 1
      },
      {
        "file": "src/desktop/renderer/features/b5/B5JourneyPresenter.js",
        "exists": true,
        "directLocalDependencies": [],
        "reachableSourceFiles": 1
      },
      {
        "file": "src/desktop/renderer/features/crafting/CraftingRequestPanel.js",
        "exists": true,
        "directLocalDependencies": [],
        "reachableSourceFiles": 1
      },
      {
        "file": "src/desktop/renderer/features/b5/B5CraftRequestPanel.js",
        "exists": true,
        "directLocalDependencies": [
          "src/desktop/renderer/features/crafting/CraftingRequestPanel.js"
        ],
        "reachableSourceFiles": 2
      },
      {
        "file": "src/desktop/renderer/features/incidents/IncidentViewModel.js",
        "exists": true,
        "directLocalDependencies": [],
        "reachableSourceFiles": 1
      },
      {
        "file": "src/desktop/renderer/features/incidents/IncidentPresenter.js",
        "exists": true,
        "directLocalDependencies": [],
        "reachableSourceFiles": 1
      },
      {
        "file": "src/desktop/renderer/features/builder/TypedModuleEditor.js",
        "exists": true,
        "directLocalDependencies": [],
        "reachableSourceFiles": 1
      },
      {
        "file": "src/desktop/renderer/features/modes/ModeViewModel.js",
        "exists": true,
        "directLocalDependencies": [],
        "reachableSourceFiles": 1
      },
      {
        "file": "src/desktop/renderer/features/connection/ConnectionViewModel.js",
        "exists": true,
        "directLocalDependencies": [],
        "reachableSourceFiles": 1
      },
      {